{"as_of":"2026-09-16T12:00:54Z","calculator_version":"0.1.0","contract_version":"0.2.0","created_at":"2026-09-16T13:25:57.453378+00:00","dependencies":[{"id":"ev-04981205b27452e5257c06f88025080f062c90ed74e4f9f7facc38590b129ae5","kind":"evidence","version":"04981205b27452e5257c06f88025080f062c90ed74e4f9f7facc38590b129ae5"},{"id":"ev-07987ab85f79f116c852e5cd8a998d949e7fb82663cf44c1ccf1833d46e7d6be","kind":"evidence","version":"07987ab85f79f116c852e5cd8a998d949e7fb82663cf44c1ccf1833d46e7d6be"},{"id":"ev-08c51abfd212f97a68a22c0e8f3895f59330897eb2613274e5b292e081be3bcd","kind":"evidence","version":"08c51abfd212f97a68a22c0e8f3895f59330897eb2613274e5b292e081be3bcd"},{"id":"ev-09f8cf231bba681a0269d7bad02587ae9dc831c9ad34246c35a6327ec8c47a50","kind":"evidence","version":"09f8cf231bba681a0269d7bad02587ae9dc831c9ad34246c35a6327ec8c47a50"},{"id":"ev-0a11c2c7bd45bc468d268a8aeebbf8ad6fc90e7968479ce0879a30ae6f0fc490","kind":"evidence","version":"0a11c2c7bd45bc468d268a8aeebbf8ad6fc90e7968479ce0879a30ae6f0fc490"},{"id":"ev-0c72c7fa12111bb2b88f5a1245abdcdc8d22a61058bc2335c4d989f4dce08cd9","kind":"evidence","version":"0c72c7fa12111bb2b88f5a1245abdcdc8d22a61058bc2335c4d989f4dce08cd9"},{"id":"ev-0d1f02405a5c19a0e37980ea5b87f0e058fc8194e6ee60a6988622f88096ca34","kind":"evidence","version":"0d1f02405a5c19a0e37980ea5b87f0e058fc8194e6ee60a6988622f88096ca34"},{"id":"ev-0fbcdc13b4a780652765333beee49647f995396d5644b3a3091069e2978b68f9","kind":"evidence","version":"0fbcdc13b4a780652765333beee49647f995396d5644b3a3091069e2978b68f9"},{"id":"ev-0fee7ec4c1bd9d5338f159369d4f7d6dd9be7321e733cebadfd40b70e70342ee","kind":"evidence","version":"0fee7ec4c1bd9d5338f159369d4f7d6dd9be7321e733cebadfd40b70e70342ee"},{"id":"ev-1390b761a532c87e847039ca23215cfbb23d052eb26ac95e403a28952991e7df","kind":"evidence","version":"1390b761a532c87e847039ca23215cfbb23d052eb26ac95e403a28952991e7df"},{"id":"ev-14275e143a1116d5a950e7bbc438185cafdb51ee090659a75729d2f16d45d64e","kind":"evidence","version":"14275e143a1116d5a950e7bbc438185cafdb51ee090659a75729d2f16d45d64e"},{"id":"ev-18a71d5db23aa7c19c7a7635a69738758a9e7ee242a6ed4cc0853dc6cc4e5705","kind":"evidence","version":"18a71d5db23aa7c19c7a7635a69738758a9e7ee242a6ed4cc0853dc6cc4e5705"},{"id":"ev-1b221559ff7a9ee1588b00f6e6c73213b021e954236c8bae08a62b94ff506df2","kind":"evidence","version":"1b221559ff7a9ee1588b00f6e6c73213b021e954236c8bae08a62b94ff506df2"},{"id":"ev-1bfeb723ebd5960632555e84ac79b49b90748b5e6831ac3a6ab6ab44a0ab3811","kind":"evidence","version":"1bfeb723ebd5960632555e84ac79b49b90748b5e6831ac3a6ab6ab44a0ab3811"},{"id":"ev-1c18bca3681dd33a225b297cd68e3f799c43a918ab0adb3b2951d1c7d90e1ff4","kind":"evidence","version":"1c18bca3681dd33a225b297cd68e3f799c43a918ab0adb3b2951d1c7d90e1ff4"},{"id":"ev-23738a988895323cc8a4ce0173e725e023bc1c7fd4fd8a660a8a87d052848664","kind":"evidence","version":"23738a988895323cc8a4ce0173e725e023bc1c7fd4fd8a660a8a87d052848664"},{"id":"ev-3053fbb5225296fd77c5b1e8c6e8a2ed7452b155ff2a7524dd05ed2c6b25d4d9","kind":"evidence","version":"3053fbb5225296fd77c5b1e8c6e8a2ed7452b155ff2a7524dd05ed2c6b25d4d9"},{"id":"ev-30e44311d93c8d346af01fb236f38479177d82a030e1dcd92b007a7009f70633","kind":"evidence","version":"30e44311d93c8d346af01fb236f38479177d82a030e1dcd92b007a7009f70633"},{"id":"ev-32cc6801d82d71c2953b11a6d0614d71124769c4e6e2f8123a5582e5a69d140d","kind":"evidence","version":"32cc6801d82d71c2953b11a6d0614d71124769c4e6e2f8123a5582e5a69d140d"},{"id":"ev-354942a78029fe1b9c39a8f3bac1f55567f741db5655c895395b88ae8681bf06","kind":"evidence","version":"354942a78029fe1b9c39a8f3bac1f55567f741db5655c895395b88ae8681bf06"},{"id":"ev-38d1f3c8b3e9a2f105b6d01c55a573ae19640b1914d90ad3581209187853bf65","kind":"evidence","version":"38d1f3c8b3e9a2f105b6d01c55a573ae19640b1914d90ad3581209187853bf65"},{"id":"ev-3e5b7386eec975eeabd220b1ba3362d630c23b606157097bfd9a8d6207f3ec72","kind":"evidence","version":"3e5b7386eec975eeabd220b1ba3362d630c23b606157097bfd9a8d6207f3ec72"},{"id":"ev-3f96d208c9bd7fefcc6042883da78cb590da0c73a92d2b008fdb35e012622001","kind":"evidence","version":"3f96d208c9bd7fefcc6042883da78cb590da0c73a92d2b008fdb35e012622001"},{"id":"ev-41590d9ead0b2f303264f22ac6f46df6c82e47e5b252bef2ba6aac9abb51af53","kind":"evidence","version":"41590d9ead0b2f303264f22ac6f46df6c82e47e5b252bef2ba6aac9abb51af53"},{"id":"ev-449f56be39e33c607bf28ce66a02a8bfa59d66bdfdc325ebcb9ffa2f70093ac9","kind":"evidence","version":"449f56be39e33c607bf28ce66a02a8bfa59d66bdfdc325ebcb9ffa2f70093ac9"},{"id":"ev-4678a6e01ecf5d993ea2aba5d2b935cbdabadc8ecd8b70df1d6838a51f15935a","kind":"evidence","version":"4678a6e01ecf5d993ea2aba5d2b935cbdabadc8ecd8b70df1d6838a51f15935a"},{"id":"ev-46a5d3ea3c5fe0774e74b1c83cafaf22fd43c100c31436b3409070ea98cb4145","kind":"evidence","version":"46a5d3ea3c5fe0774e74b1c83cafaf22fd43c100c31436b3409070ea98cb4145"},{"id":"ev-46f83a4daf726ac382a3d0d84767d9ed49b8d9e583f83898aa7e526d9730f3d5","kind":"evidence","version":"46f83a4daf726ac382a3d0d84767d9ed49b8d9e583f83898aa7e526d9730f3d5"},{"id":"ev-4df1336efa2d7b08605cf29c3495f00e45609e0e58287ebf22fb7641a533ca09","kind":"evidence","version":"4df1336efa2d7b08605cf29c3495f00e45609e0e58287ebf22fb7641a533ca09"},{"id":"ev-50aa6aa19d63c97fb350531e141290f1be6e548f2ded03ac13208a0bb5ae72db","kind":"evidence","version":"50aa6aa19d63c97fb350531e141290f1be6e548f2ded03ac13208a0bb5ae72db"},{"id":"ev-5531662e9ea50a4df83e20cdaf08788b78e6793b618c86ac0ce93cff91b9a0e0","kind":"evidence","version":"5531662e9ea50a4df83e20cdaf08788b78e6793b618c86ac0ce93cff91b9a0e0"},{"id":"ev-554800079b1d304bb071d6c977d654c64a6ac91bc287ca47b70188bc8f1d1722","kind":"evidence","version":"554800079b1d304bb071d6c977d654c64a6ac91bc287ca47b70188bc8f1d1722"},{"id":"ev-59d1631a76ffbf035ac70e348dd2d89b5214f5352851e8e9b9d897b49de9d3a6","kind":"evidence","version":"59d1631a76ffbf035ac70e348dd2d89b5214f5352851e8e9b9d897b49de9d3a6"},{"id":"ev-5a68289a54f5cddff2768c9c36e501653362c793a2b64ec8759247c251a3afae","kind":"evidence","version":"5a68289a54f5cddff2768c9c36e501653362c793a2b64ec8759247c251a3afae"},{"id":"ev-5c734b9b09daf717cd0967c4537ad737773eaed26c11bf77c0c1cfd001e8cf19","kind":"evidence","version":"5c734b9b09daf717cd0967c4537ad737773eaed26c11bf77c0c1cfd001e8cf19"},{"id":"ev-5def3bd67e6430bcfc3dbb0bfa7c7bbe07f99599efaf8823a37c151f55f8e9d7","kind":"evidence","version":"5def3bd67e6430bcfc3dbb0bfa7c7bbe07f99599efaf8823a37c151f55f8e9d7"},{"id":"ev-5ea79b46cd9b9e3812d0e6ba4474946c66d611aa425f4cbfdfb7c72e6239acfe","kind":"evidence","version":"5ea79b46cd9b9e3812d0e6ba4474946c66d611aa425f4cbfdfb7c72e6239acfe"},{"id":"ev-65c1d6051547b63b6cb0d77737770c0ab2260b31bdc622f6d54397f0b2706822","kind":"evidence","version":"65c1d6051547b63b6cb0d77737770c0ab2260b31bdc622f6d54397f0b2706822"},{"id":"ev-69f2597488510eb5f38e7302734c178689835a614a14aaa69b18b58c48d38491","kind":"evidence","version":"69f2597488510eb5f38e7302734c178689835a614a14aaa69b18b58c48d38491"},{"id":"ev-76fa17431a306e5f3d196eb46af2a00c04ca2de0327c9db440ae3bf39eed7c03","kind":"evidence","version":"76fa17431a306e5f3d196eb46af2a00c04ca2de0327c9db440ae3bf39eed7c03"},{"id":"ev-7b1c68269f9aab455d537be3b7a2c4e1663b8c31b6046d34a8fa41ec320b71ff","kind":"evidence","version":"7b1c68269f9aab455d537be3b7a2c4e1663b8c31b6046d34a8fa41ec320b71ff"},{"id":"ev-7cacd600514599ca7464780cea6cad2c8714ae4d7226d3e4e6061e68242a1488","kind":"evidence","version":"7cacd600514599ca7464780cea6cad2c8714ae4d7226d3e4e6061e68242a1488"},{"id":"ev-800df2d03be63909e47e76151068fe5f6aa3905250854c245ff3947b585727c0","kind":"evidence","version":"800df2d03be63909e47e76151068fe5f6aa3905250854c245ff3947b585727c0"},{"id":"ev-8335475e21cd45697c5e45176ec7fb0edbe62c2d1cd8a478070c1ce18893d731","kind":"evidence","version":"8335475e21cd45697c5e45176ec7fb0edbe62c2d1cd8a478070c1ce18893d731"},{"id":"ev-86439c5982335a2eb85709ec75e456b0808cfb37cf62fc2f5a3621bb514003d6","kind":"evidence","version":"86439c5982335a2eb85709ec75e456b0808cfb37cf62fc2f5a3621bb514003d6"},{"id":"ev-8759adf108ccb656ada2350e19357006064845544e1b4fd86b093f17c35e6ad3","kind":"evidence","version":"8759adf108ccb656ada2350e19357006064845544e1b4fd86b093f17c35e6ad3"},{"id":"ev-88c91b6acd468693d8eee117acc303d0046be61a3fe009b83c070aa747707828","kind":"evidence","version":"88c91b6acd468693d8eee117acc303d0046be61a3fe009b83c070aa747707828"},{"id":"ev-8b651dcdd1850f2abbded9d631485be1d67a1c9be062d6f686d4ac4aa2b7e30a","kind":"evidence","version":"8b651dcdd1850f2abbded9d631485be1d67a1c9be062d6f686d4ac4aa2b7e30a"},{"id":"ev-8c4e5418ebbc5526770bced33a797a9e4b5f95d682315bfe1e0a007dfaff64e6","kind":"evidence","version":"8c4e5418ebbc5526770bced33a797a9e4b5f95d682315bfe1e0a007dfaff64e6"},{"id":"ev-8d64828781ec65165f921defa5ed8ef6360aa44530f7236ab9fae6d91e83d7f9","kind":"evidence","version":"8d64828781ec65165f921defa5ed8ef6360aa44530f7236ab9fae6d91e83d7f9"},{"id":"ev-90fb138cd6a1a645b2b9e90e256383e40e716508220b93209c83970cf3247530","kind":"evidence","version":"90fb138cd6a1a645b2b9e90e256383e40e716508220b93209c83970cf3247530"},{"id":"ev-9116bc73b4c6c5f5eb8840ed07c90bd9815eeb01b234ee8c2c3c6dd5ff41e514","kind":"evidence","version":"9116bc73b4c6c5f5eb8840ed07c90bd9815eeb01b234ee8c2c3c6dd5ff41e514"},{"id":"ev-91f22ad77032190f3f8a6687e4b71b776651223b8026f0c281ec676b7f702eb6","kind":"evidence","version":"91f22ad77032190f3f8a6687e4b71b776651223b8026f0c281ec676b7f702eb6"},{"id":"ev-932d0d012b60de39642b246ea969e29e3f8a491a2093d7928d2797ad5ece81cb","kind":"evidence","version":"932d0d012b60de39642b246ea969e29e3f8a491a2093d7928d2797ad5ece81cb"},{"id":"ev-971fe1ef2e7fb7ec44c60097c846287cfaade62a13066c9c11621a0a4ba58448","kind":"evidence","version":"971fe1ef2e7fb7ec44c60097c846287cfaade62a13066c9c11621a0a4ba58448"},{"id":"ev-9811b726ada9cb07b21bc3fc919f1c176684b4f95dbc0481170cfb11b32119f6","kind":"evidence","version":"9811b726ada9cb07b21bc3fc919f1c176684b4f95dbc0481170cfb11b32119f6"},{"id":"ev-987818f88e42797d207c16d405ae970dffa54c0d7f0e9a1d8fe5022c8150c0f2","kind":"evidence","version":"987818f88e42797d207c16d405ae970dffa54c0d7f0e9a1d8fe5022c8150c0f2"},{"id":"ev-98d59002d6e663c694ec843264e47c6977